units,words,mean_cn,sentence,sentence_tra
Unit1,worthwhile,adj.值得(花时间、精力)的，合算的,"I hate the job, but the money makes it worthwhile.",我恨这个工作，但是钱让它值得花时间和精力去做。
Unit1,Quaker,n.夸克党；教友派信徒,The Quakers are a religious movement whose first tenet is non-violence.,夸克党是个宗教运动，一开始它的教义是非暴力的。
Unit1,organization,n.组织体制；团体；机构,"In our organization, everyone takes orders from me - is that clear?",在我们的组织中，每个人都听令于我――明白了吗？
Unit1,behave,v.举动，运转；举止端正(或良好、适当),"""Now, you behave at school!"" shouted the angry father.",“现在，你给我在学校好好表现！”愤怒的父亲咆哮道。
Unit1,specialist,n. 专家; 专科医生;  adj. 专家的; 专业的;  ,Be relaxed! We are specialists for plastic surgery! ,放心吧！我们可是整容专家！
Unit1,respect,v. 尊敬，敬重n. 敬重，尊敬；方面,Japanese people show respect by bowing.,日本人通过鞠躬来表达尊重。
Unit1,career,n.职业，事业，生涯，经历,She has built her career as a businesswoman.,她以一个女商人的身份开始了职业生涯。
Unit5,various,adj.各种各样的，不同的,We saw various types of fish during our dive.,在潜水时我们看到了各种各样的鱼。
Unit5,joust,n.竞技；厮打v.进行马上长矛比武；竞争,The two men are jousting.,这两个人在进行马上长矛比武。
Unit5,jungle,n. 丛林,The elephants take us deeper into the jungle.,大象们带我们深入丛林。
Unit5,tournament,n.锦标赛，联赛；比赛,The basketball tournament will end with a single winner.,这次篮球联赛会只有一个获胜队伍。
Unit5,settler,n.移民者,The settlers traveled very far.,这些移民者经历了长途跋涉。
Unit5,craftsman,n. 工匠；手艺人；技工,The old craftsman is concentrating on his art work.,这个年迈的工匠正专注于自己的艺术作品。
Unit5,advance,v. 提升，提前n. 前进，增长，接近,I'd like to advance as high up in this company as possible.,我想在这座公司里尽可能地爬高。
Unit5,fantasy,"n. 幻想;  幻想作品;  vi. 奏幻想曲;  vt. 想像, 幻想;  ",My greatest fantasy is to be showered in money.,我最大的幻想就是沐浴在钞票里。
Unit5,bald,adj.秃头的,"Wait, why am I combing my hair?--I'm bald, I don't have any hair.",等等，我为什么要梳头？我是秃头，我根本没有头发。
Unit5,souvenir,n.纪念物，纪念品,I bought this flag as a souvenir on my trip.,我在旅途中买了这面旗子作为纪念品。
Unit5,admission,n. 准许进入;  进入权;  入场费;  录用;  承认;  确认的事实;  ,"Sorry, no admission - you can't come in!",抱歉，未经允许，不得入内！
Unit5,outing,n.远足；短途旅游,On summer weekends we try to arrange a family outing to the beach.,夏季周末，我们打算计划一次全家出游去海边。
Unit5,tourism,n.旅游，旅游业,The beach is a popular location for tourism.,海边是旅游胜地。
Unit5,pirate,n. 海盗;  剽窃者;  vt. 以海盗方式掠夺;  剽窃;  ,We're going to dress up as pirates for the costume party.,我们在化装舞会中要打扮成海盗的样子。
Unit5,minority,n. 少数; 少数民族; 未成年;  adj. 构成少数的;  ,These ethnic minorities wear colorful clothes.,少数民族穿着颜色各异的服饰。
Unit5,amusement,n. 娱乐,Going on amusement park rides terrifies me.,还要再玩这种游乐设施，我受不了啊！
Unit5,athletic,adj.运动的，体育的，强壮的,The athletic man runs for long distances without needing to rest.,运动员可以跑很长距离并且不用休息。
Unit5,preserve,v.保护，保存,This mosquito will be preserved for thousands of years!,这只蚊子能够保存上千年！
Unit5,roller coaster,n.过山车,Let's go to the amusement park and take a ride on the roller coaster!,我们去游乐园玩过山车吧！
Unit5,creature,n.人；生物；动物,"Is your favorite creature the dog, cat, or rabbit?",你最喜欢的动物是狗，猫还是兔子？
Unit5,translator,n.翻译者；翻译器,This electronic translator is easy to use.,这个电子辞典非常好用。
Unit5,shuttle,,The shuttle will take us to the airport.,机场大巴会接我们去机场。
Unit5,attraction,n.吸引，吸引力，具有吸引力的事物(或人),"As soon as we met, there was an instant attraction between us.",我们一见面，我们之间瞬间就有一种吸引力。
Unit5,carpenter,"n. 木匠, 木工;  ",The carpenter works on the house.,木匠从事房屋（建造）工作。
Unit5,diver,n. 潜水员;  ,"If you want to be a deep sea diver, you'll have to practice.",如果你想成为一名深海潜水员，你需要练习。
Unit5,knight,n. 骑士,The knight protected our village from intruders. ,骑士保护我们的村庄免于入侵。
Unit5,cloth,n.布；衣料；桌布,This cloth has a beautiful design. ,这匹布设计得很漂亮。
Unit5,theme,n. 主题;  主旨;  作文;  adj. 主题的;  ,The birthday party has a clown theme.,这个生日派对的主题是扮小丑。
Unit5,sunlight,n. 日光，阳光 ,The sunlight brightens the green field.,阳光照亮了绿地。
Unit5,get close to,接近,Me and my best friend like to get close to each other.,我和我最好的朋友喜欢互相亲近。
Unit5,be modelled after,根据……模仿；仿造,My young son's behaviour is all modelled after Einstein's.,我小儿的行为几乎都是模仿的爱因斯坦。
Unit5,swing,"n. 摇摆;  摆幅;  转弯;  打击;  旋律;  vi. 摇荡;  来回摆动;  转动;  转向;  vt. 使摇摆;  使转动;  使, 转向;",He swings in the forest from tree to tree.,他在丛林树间荡来荡去。
Unit5,come to life,活跃起来,Zombies are dead people come to life.,丧尸是复活的死人。
Unit5,fairy tale,神话故事；童话,Only in fairy tales do frogs turn into princes!,只有在童话故事中青蛙才能变成王子。
Unit5,freeway,n.高速公路,I'm happy when I get on the freeway because I don't have to wait for traffic lights.,上高速时我开心极了，因为我再也不用等红灯了。
Unit5,sneaker,n. 鬼鬼祟祟的人; 运动鞋; ,"My yellow sneakers are comfortable, fit my feet, and look good!",我的黄色运动鞋很舒服，合脚又好看！真棒！
Unit5,deed,n.行为；功绩；契约,In his superhero identity he could do brave and difficult deeds.,以他超人的身份他能做到勇敢并且困难的事。
Unit5,length,n.长，长度,I use a tape to measure the length of the wood.,我用卷尺测量木头长度。
Unit5,in advance,提前，预先,It's hard to tell what the weekend's weather will be in advance.,提前预告周末的天气很困难。
Unit5,whichever,pron. 无论哪个； 无论哪些,I will have whichever drink is most delicious.,无论哪种饮料，只要是最好喝的就行。
Unit5,wherever,adv.无论在哪里,"Wherever you want your package to go, we can deliver it.",无论你想让你的行李去哪儿，我们都能传送。
Unit5,advanced,adj.先进的，高级的,This science seems to be too advanced for him!,看起来科学对他来说太难（高级）了。
Unit5,be famous for,以……而闻名,Einstein was famous for funny hair as well as physics.,爱因斯坦有趣的头发跟他的物理学一样出名。
Unit5,central,adj.中心的；主要的,We should all meet at a central point. ,我们都应该去中心点那碰头。
Unit5,unique,adj.独特的，独一无二的adj.(唯一的) 特有的,Fingerprints are unique to each individual.,每个人的指纹都是独一无二的。
Unit5,brand,,These companies all have very well-known brands.,这些公司都有非常知名的品牌。
Unit5,cartoon,n. 卡通，漫画,This is a cartoon of Noah's Ark.,这是诺亚方舟的漫画。
Unit5,engine,n.引擎，发动机,There was a problem with the engine of my car. ,我车里的引擎出了点问题。
Unit5,sword,n.剑，刀,At the museum they had a sword on display that was over 800 years old.,在博物馆陈列着一把有八百多年历史的剑。
Unit4,statement,n. 声明，陈述；结算单，报表,He gave a statement to the news reporters.,他向记者发表了一份声明。
Unit4,defend,v. 防卫，保卫，防守,Our anti-virus software will defend your computer against attacks.,我们的杀毒软件能帮助你的电脑抵御攻击。
Unit4,anger,,She cannot control her anger.,她不能控制自己的怒火。
Unit4,rank,,I don't like the way our teacher ranks all the students from best to worst.,我不喜欢老师这种把所有学生从最好到最差分等级的做法。
Unit4,cheek,"n. 面颊, 脸蛋;  vt. 无礼地说;  ",She used a cream on her cheeks to take care of her skin.,她把面霜涂在脸颊上来保养皮肤。
Unit4,simply,adv.简单地，明了的，仅仅,I like to eat simply: just plain vegetables for me.,我喜欢吃简单些，只要给我些普通的的蔬菜就行。
Unit4,flight,n.航班，飞行，逃跑,I have to get to the airport quickly--my flight leaves in an hour!,我必须赶快到达机场――我的飞机在一个小时后要飞了！
Unit4,be likely to,很可能……；有希望……,This is a good set of cards that is likely to win the game.,这是一副好牌，可能能赢得游戏。
Unit4,curiously,adv.好奇地；奇怪地,That's a very curiously placed conference table!,那些会议桌摆放得不可思议。
Unit4,likely,adj.有可能；可信的；适合的adv.很可能,"If you see dark clouds, it's likely that it will rain.",如果你看到乌云，可能会下雨。
Unit4,spoken,adj.口语的，口头的,English and Chinese are some of the world's most commonly spoken languages.,英语和汉语是世界上最常用的口语。
Unit4,adult,n. 成年人;  adj. 成年的;  成年人的;  色情的;  ,We're both adults now - kiss me!,我们都是成年人了，亲亲我！
Unit4,false,adj.错误的，虚伪的，伪造的,Her false identity fooled all of us at first.,一开始她的假身份欺骗了我们所有人。
Unit4,misunderstand,v.误解，误会,I think he misunderstands the recipe.,我认为他误解了食谱（上的做法）。
Unit4,Italy, n. 意大利,I love going to Italy for the food and sightseeing.,我喜欢去意大利因为那有美味的食物和美丽的风景。
Unit4,Spain,n. 西班牙;,Spain is famous for bull fights and flamenco dancing.,西班牙以斗牛和弗拉门科舞而闻名。
Unit4,misread,vt．读错；误解,We're lost - we must have misread the map.,我们迷路了――我们肯定错读了地图。
Unit4,represent,v.描述，表示；代表，代理；阐明，说明,These pictures represent different kinds of weather.,这些图片代表了不同类型的天气。
Unit4,yawn,n. 呵欠;  裂开;  vi. 打呵欠;  裂开;  vt. 打着呵欠说;  ,"""I'm so tired,"" she said as she yawned.",“我好累啊，”她打着哈欠说。
Unit4,association,"n. 结合;  伙伴, 关系;  协会, 联盟;  联想;  ",Our association has many members with different skills.,我们的协会里有很多拥有不同技能的成员。
Unit4,misunderstanding,n. 误解，误会；,"""I'm not a snake; this is a misunderstanding!""",我不是蛇，这是个误会！
Unit4,dash,,All the racers dash forward.,所有选手向前猛冲。
Unit4,greet,v.问候，招呼；反应,This gentleman takes his hat off to greet people.,这位绅士脱下他的帽子，向人们问好。
Unit4,posture,n.姿势，姿态；看法，态度,My mom always told me to keep a straight posture. ,我妈妈总提醒我保持挺直的姿势。
Unit4,frown,n. 皱眉;  不悦;  vi. 皱眉;  不赞成;  vt. 使哑口无言;  ,Grace set her face into a frown; she was not happy at all.,Grace姐姐的脸皱成了一团，她一点也不开心。
Unit4,defence,n.防御，防务，辩护 ,The woman learns self defence.,这个女人学习自卫。
Unit4,Jordan,n. 约旦,"Jordan lies to the East of Israel, in the Middle East.",约旦位于中东，在以色列的东部。
Unit4,Colombia,n．哥伦比亚(南美洲国家),Columbia is unfortunately mostly famous for its drug trade.,很不幸的是哥伦比亚主要以毒品交易而出名。
Unit4,canteen,n. 食堂，小卖部，水壶,Let's go get some food at the canteen.,我们一起去食堂吃点东西吧。
Unit4,muslim,n.穆斯林，穆罕默德信徒 adj.穆斯林的,Muslim women are required to cover their body and hair with a special dress.,穆斯林妇女需要用特殊的衣服遮住身体和头发。
Unit4,unspoken,adj.无言的；未说出口的；不言而喻的,Hush - let our secret remain forever unspoken!,嘘，永远别说出我们的秘密！
Unit4,major,n. 上级; 少校; 专业;  vi. 专攻;  adj. 较大的; 重要的; 主要的;  ,"In chess, the king is your most major piece.", 在国际象棋中，国王是你最重要的棋子。
Unit4,ease,,Lying in the grass gives her a feeling of ease and comfort.,躺在草地上让她轻松舒适。
Unit4,respectful,adj. 恭敬的；有礼貌的,She greeted us in a respectful manner.,她有礼貌地问候了我们。
Unit4,function,n.功能，作用，[pl.]职务，职责；函数v.起作用；正常运转,The function of our digestive system is to feed us and keep us alive.,消化系统的功能是为我们提供营养并维持生命。
Unit4,in general,总的说来,"In general swans are white, but there are some black swans.",天鹅通常是白色的，但也有黑色的天鹅存在。
Unit4,facial,"n. 面部按摩, 美容;  adj. 表面的, 面部的;  ",Facials help keep her skin looking great.,美容能帮助她保持皮肤看起来光滑细嫩的状态。
Unit4,fist,n. 拳头;  笔迹;  vt. 用拳头打;  握成拳;  紧握;  ,The boy clenches his fist with an ambitious look.,男孩握紧拳头，一脸雄心勃勃的样子。
Unit4,approach,,The elephants are approaching us.,一群大象正在靠近我们。
Unit4,truly,adv.真实地；真心地,He must truly love you if he gave you flowers.,如果他送你花就证明他一定真的爱上你了。
Unit4,at ease,舒适；快活；自由自在,"You look very much at ease, lying on that sofa!",你躺在沙发上看起来很放松。
Unit4,subjective,adj.主观(上)的，个人的 ,"Liking wine is subjective - some people do, some people don't.",喝酒是个人喜好，有的人喜欢，有的人不喜欢。
Unit4,lose face,丢面子,Her embarrassing slip-up caused her to lose face in front of her friends.,她那令人尴尬的错误让她在她的朋友面前丢了面子。
Unit4,dormitory,n. 集体宿舍;  宿舍;  ,Our school just constructed a new 400-bed dormitory for the incoming class. ,我们学校刚刚修了一个能容下400张床的宿舍给新生住。
Unit4,employee,n.受雇者，雇员，雇工，职员,"As the boss, I care about all my employees.",作为老板，我非常在意我的员工们。
Unit4,curious,adj. 好奇的;  好管闲事的;  古怪的;  ,The kitten is curious about that cactus. ,小猫对那盆仙人掌很好奇。
Unit4,hug,v.紧抱；拥抱n.拥抱,The happy couple hugs in front of their new house.,这对开心的夫妇相拥在他们的新房子前。
